[
  {
    "id": "philosophy-道德与文明",
    "name": "道德与文明",
    "alias": null,
    "subject": "哲学",
    "subject_id": "philosophy",
    "source": "main",
    "cssci_year": "2025-2026",
    "rank_in_subject": 1,
    "has_format_spec": false,
    "format_spec_id": null
  },
  {
    "id": "philosophy-科学技术哲学研究",
    "name": "科学技术哲学研究",
    "alias": null,
    "subject": "哲学",
    "subject_id": "philosophy",
    "source": "main",
    "cssci_year": "2025-2026",
    "rank_in_subject": 2,
    "has_format_spec": false,
    "format_spec_id": null
  },
  {
    "id": "philosophy-伦理学研究",
    "name": "伦理学研究",
    "alias": null,
    "subject": "哲学",
    "subject_id": "philosophy",
    "source": "main",
    "cssci_year": "2025-2026",
    "rank_in_subject": 3,
    "has_format_spec": false,
    "format_spec_id": null
  },
  {
    "id": "philosophy-逻辑学研究",
    "name": "逻辑学研究",
    "alias": null,
    "subject": "哲学",
    "subject_id": "philosophy",
    "source": "main",
    "cssci_year": "2025-2026",
    "rank_in_subject": 4,
    "has_format_spec": false,
    "format_spec_id": null
  },
  {
    "id": "philosophy-世界哲学",
    "name": "世界哲学",
    "alias": null,
    "subject": "哲学",
    "subject_id": "philosophy",
    "source": "main",
    "cssci_year": "2025-2026",
    "rank_in_subject": 5,
    "has_format_spec": true,
    "format_spec_id": "world-philosophy"
  },
  {
    "id": "philosophy-现代哲学",
    "name": "现代哲学",
    "alias": null,
    "subject": "哲学",
    "subject_id": "philosophy",
    "source": "main",
    "cssci_year": "2025-2026",
    "rank_in_subject": 6,
    "has_format_spec": false,
    "format_spec_id": null
  },
  {
    "id": "philosophy-哲学动态",
    "name": "哲学动态",
    "alias": null,
    "subject": "哲学",
    "subject_id": "philosophy",
    "source": "main",
    "cssci_year": "2025-2026",
    "rank_in_subject": 7,
    "has_format_spec": true,
    "format_spec_id": "philosophy-trends"
  },
  {
    "id": "philosophy-哲学分析",
    "name": "哲学分析",
    "alias": null,
    "subject": "哲学",
    "subject_id": "philosophy",
    "source": "main",
    "cssci_year": "2025-2026",
    "rank_in_subject": 8,
    "has_format_spec": true,
    "format_spec_id": "philosophical-analysis"
  },
  {
    "id": "philosophy-哲学研究",
    "name": "哲学研究",
    "alias": null,
    "subject": "哲学",
    "subject_id": "philosophy",
    "source": "main",
    "cssci_year": "2025-2026",
    "rank_in_subject": 9,
    "has_format_spec": true,
    "format_spec_id": "philosophy-research"
  },
  {
    "id": "philosophy-哲学与文化",
    "name": "哲学与文化",
    "alias": null,
    "subject": "哲学",
    "subject_id": "philosophy",
    "source": "main",
    "cssci_year": "2025-2026",
    "rank_in_subject": 10,
    "has_format_spec": false,
    "format_spec_id": null
  },
  {
    "id": "philosophy-政治大学哲学学报",
    "name": "政治大学哲学学报",
    "alias": null,
    "subject": "哲学",
    "subject_id": "philosophy",
    "source": "main",
    "cssci_year": "2025-2026",
    "rank_in_subject": 11,
    "has_format_spec": false,
    "format_spec_id": null
  },
  {
    "id": "philosophy-中国文哲研究集刊",
    "name": "中国文哲研究集刊",
    "alias": null,
    "subject": "哲学",
    "subject_id": "philosophy",
    "source": "main",
    "cssci_year": "2025-2026",
    "rank_in_subject": 12,
    "has_format_spec": false,
    "format_spec_id": null
  },
  {
    "id": "philosophy-中国哲学史",
    "name": "中国哲学史",
    "alias": null,
    "subject": "哲学",
    "subject_id": "philosophy",
    "source": "main",
    "cssci_year": "2025-2026",
    "rank_in_subject": 13,
    "has_format_spec": true,
    "format_spec_id": "chinese-philosophy-history"
  },
  {
    "id": "philosophy-自然辩证法通讯",
    "name": "自然辩证法通讯",
    "alias": null,
    "subject": "哲学",
    "subject_id": "philosophy",
    "source": "main",
    "cssci_year": "2025-2026",
    "rank_in_subject": 14,
    "has_format_spec": false,
    "format_spec_id": null
  },
  {
    "id": "philosophy-自然辩证法研究",
    "name": "自然辩证法研究",
    "alias": null,
    "subject": "哲学",
    "subject_id": "philosophy",
    "source": "main",
    "cssci_year": "2025-2026",
    "rank_in_subject": 15,
    "has_format_spec": false,
    "format_spec_id": null
  },
  {
    "id": "philosophy-国际儒学",
    "name": "国际儒学",
    "alias": "中英文",
    "subject": "哲学",
    "subject_id": "philosophy",
    "source": "ext",
    "cssci_year": "2025-2026",
    "rank_in_subject": 16,
    "has_format_spec": false,
    "format_spec_id": null
  },
  {
    "id": "philosophy-孔学堂",
    "name": "孔学堂",
    "alias": null,
    "subject": "哲学",
    "subject_id": "philosophy",
    "source": "ext",
    "cssci_year": "2025-2026",
    "rank_in_subject": 17,
    "has_format_spec": false,
    "format_spec_id": null
  },
  {
    "id": "philosophy-马克思主义哲学",
    "name": "马克思主义哲学",
    "alias": null,
    "subject": "哲学",
    "subject_id": "philosophy",
    "source": "ext",
    "cssci_year": "2025-2026",
    "rank_in_subject": 18,
    "has_format_spec": false,
    "format_spec_id": null
  },
  {
    "id": "philosophy-系统科学学报",
    "name": "系统科学学报",
    "alias": null,
    "subject": "哲学",
    "subject_id": "philosophy",
    "source": "ext",
    "cssci_year": "2025-2026",
    "rank_in_subject": 19,
    "has_format_spec": false,
    "format_spec_id": null
  },
  {
    "id": "history-安徽史学",
    "name": "安徽史学",
    "alias": null,
    "subject": "历史学",
    "subject_id": "history",
    "source": "main",
    "cssci_year": "2025-2026",
    "rank_in_subject": 1,
    "has_format_spec": true,
    "format_spec_id": "anhui-historical"
  },
  {
    "id": "history-当代中国史研究",
    "name": "当代中国史研究",
    "alias": null,
    "subject": "历史学",
    "subject_id": "history",
    "source": "main",
    "cssci_year": "2025-2026",
    "rank_in_subject": 2,
    "has_format_spec": false,
    "format_spec_id": null
  },
  {
    "id": "history-东南文化",
    "name": "东南文化",
    "alias": null,
    "subject": "历史学",
    "subject_id": "history",
    "source": "main",
    "cssci_year": "2025-2026",
    "rank_in_subject": 3,
    "has_format_spec": false,
    "format_spec_id": null
  },
  {
    "id": "history-古代文明",
    "name": "古代文明",
    "alias": null,
    "subject": "历史学",
    "subject_id": "history",
    "source": "main",
    "cssci_year": "2025-2026",
    "rank_in_subject": 4,
    "has_format_spec": false,
    "format_spec_id": null
  },
  {
    "id": "history-国际汉学",
    "name": "国际汉学",
    "alias": null,
    "subject": "历史学",
    "subject_id": "history",
    "source": "main",
    "cssci_year": "2025-2026",
    "rank_in_subject": 5,
    "has_format_spec": false,
    "format_spec_id": null
  },
  {
    "id": "history-华侨华人历史研究",
    "name": "华侨华人历史研究",
    "alias": null,
    "subject": "历史学",
    "subject_id": "history",
    "source": "main",
    "cssci_year": "2025-2026",
    "rank_in_subject": 6,
    "has_format_spec": false,
    "format_spec_id": null
  },
  {
    "id": "history-近代史研究",
    "name": "近代史研究",
    "alias": null,
    "subject": "历史学",
    "subject_id": "history",
    "source": "main",
    "cssci_year": "2025-2026",
    "rank_in_subject": 7,
    "has_format_spec": true,
    "format_spec_id": "modern-history-research"
  },
  {
    "id": "history-经济社会史评论",
    "name": "经济社会史评论",
    "alias": null,
    "subject": "历史学",
    "subject_id": "history",
    "source": "main",
    "cssci_year": "2025-2026",
    "rank_in_subject": 8,
    "has_format_spec": false,
    "format_spec_id": null
  },
  {
    "id": "history-抗日战争研究",
    "name": "抗日战争研究",
    "alias": null,
    "subject": "历史学",
    "subject_id": "history",
    "source": "main",
    "cssci_year": "2025-2026",
    "rank_in_subject": 9,
    "has_format_spec": false,
    "format_spec_id": null
  },
  {
    "id": "history-历史档案",
    "name": "历史档案",
    "alias": null,
    "subject": "历史学",
    "subject_id": "history",
    "source": "main",
    "cssci_year": "2025-2026",
    "rank_in_subject": 10,
    "has_format_spec": false,
    "format_spec_id": null
  },
  {
    "id": "history-历史人类学学刊",
    "name": "历史人类学学刊",
    "alias": null,
    "subject": "历史学",
    "subject_id": "history",
    "source": "main",
    "cssci_year": "2025-2026",
    "rank_in_subject": 11,
    "has_format_spec": false,
    "format_spec_id": null
  },
  {
    "id": "history-历史研究",
    "name": "历史研究",
    "alias": null,
    "subject": "历史学",
    "subject_id": "history",
    "source": "main",
    "cssci_year": "2025-2026",
    "rank_in_subject": 12,
    "has_format_spec": true,
    "format_spec_id": "historical-research"
  },
  {
    "id": "history-历史语言研究所集刊",
    "name": "历史语言研究所集刊",
    "alias": null,
    "subject": "历史学",
    "subject_id": "history",
    "source": "main",
    "cssci_year": "2025-2026",
    "rank_in_subject": 13,
    "has_format_spec": false,
    "format_spec_id": null
  },
  {
    "id": "history-民国档案",
    "name": "民国档案",
    "alias": null,
    "subject": "历史学",
    "subject_id": "history",
    "source": "main",
    "cssci_year": "2025-2026",
    "rank_in_subject": 14,
    "has_format_spec": false,
    "format_spec_id": null
  },
  {
    "id": "history-清史研究",
    "name": "清史研究",
    "alias": null,
    "subject": "历史学",
    "subject_id": "history",
    "source": "main",
    "cssci_year": "2025-2026",
    "rank_in_subject": 15,
    "has_format_spec": false,
    "format_spec_id": null
  },
  {
    "id": "history-史林",
    "name": "史林",
    "alias": null,
    "subject": "历史学",
    "subject_id": "history",
    "source": "main",
    "cssci_year": "2025-2026",
    "rank_in_subject": 16,
    "has_format_spec": true,
    "format_spec_id": "shilin"
  },
  {
    "id": "history-史学集刊",
    "name": "史学集刊",
    "alias": null,
    "subject": "历史学",
    "subject_id": "history",
    "source": "main",
    "cssci_year": "2025-2026",
    "rank_in_subject": 17,
    "has_format_spec": true,
    "format_spec_id": "shixue-jikan"
  },
  {
    "id": "history-史学理论研究",
    "name": "史学理论研究",
    "alias": null,
    "subject": "历史学",
    "subject_id": "history",
    "source": "main",
    "cssci_year": "2025-2026",
    "rank_in_subject": 18,
    "has_format_spec": true,